Senior Content Operations Manager (m/f/d),Marketing,Remote,,"We are looking for a driven, passionate Senior Content Operations Manager (m/f/d) to join our amazing marketing team and be part of Appinio’s future growth around the world.In this role, you will have the responsibility to define and develop Appinio’s future content propositions by combining insights with creative ideas. In order to spread the excitement across several markets and industries, you will collaborate with our marketing, design, research and business development teams. You will support scaling our content creation processes to a global level to match the rocketing growth of Appinio’s products.
 
 
YOUR TASKS

Work alongside a team of content marketing, design, research, sales and business development colleagues to develop top notch content that excites our target audiences & is aligned with our marketing goals
Be in charge of the planning and execution of our global content creation projects in collaboration with our internal content marketing specialists as well as partners or external content creators
Set up and lead an organization structure, with which teams will produce industry specific content at speed, without compromising on standard of work
Create global and local content plans based on market needs and in cooperation with the respective country managers and sales directors

YOUR PROFILE

You have a degree in Marketing, Communications, Journalism or similar
You bring minimum 2+ years of work experience in project management, content operations and creative planning
Exceptional organizational and process skills; you love creating order out of chaos and collaborating with creative teams to get things done
Experience working in digital marketing and B2B, ideally in SaaS or Tech and within multinational organizations
German is a plus

OUR BENEFITS

Flexibility Policy - meaning you are free to take off as many paid vacation days as you need, no maximum
Work-from-anywhere Policy - meaning you have the chance to develop our amazing product anywhere in the world -within reason ;-)
Subsidized Urban Sports Club membership
All the hardware you need and your own MacBook
In case you're located in Hamburg you'll get a subsidized HVV ticket or if you're located in Hamburg or Berlin you'll get access to a mobility budget with the RYDES app
In case you're located in Hamburg you'll get access to our beautiful office in Hamburg's city center - terrace and BBQ included ;-)





ABOUT APPINIO


At Appinio, we help companies always make the right decisions through real-time market research. As the world’s largest opinion network, we collect millions of responses from consumers every day to allow our clients to turn their questions to insights in minutes. Over 2000+ companies worldwide rely on us to understand how their consumers think.
 
We started small in Hamburg back in 2014 but we’re now humbled to call the world our playground, with over +200 employees spread across 25 countries, 2000 international clients and a panel reach of 7 million, globally.
 
Appinio is an equal opportunity employer. All applicants will be considered for employment without attention to race, color, religion, sex, sexual orientation, gender identity, national origin, veteran or disability status.
 






Learn more about us:

 appinio.com    LinkedIn    Xing     Kununu    Instagram

 ",https://boards.eu.greenhouse.io/appinio/jobs/4083694101
Account Executive - DACH (m/f/d) ,Client Relations,Remote,,"


YOUR ROLE



Appinio is looking for a highly driven and passionate Account Executive (m/f/d) to join our strong team of 8+ sales reps in the DACH market. In this role you will be in charge of one of our exciting verticals where your expert knowledge is needed to coordinate all related account activities. This position gives you the chance to present the potential of Appinio to stakeholders on all levels and to create a trust-based commercial relationship with them.
Since we believe that each employee creates the most value when they work according to their specific expertise, you can choose between the following verticals:  Agencies, Media & Entertainment, Pharma & Life Sciences and Retail. 

 
YOUR TASKS

Representation of Appinio to prospects in the dedicated sector
Acquiring new customers and coaching them regarding potential applications of Appinio's agile SaaS solutions
Building a strong network 
Public Speaker opportunities at events and trade fair appearances

YOUR PROFILE

Minimum 1-2 years of experience in sales or other commercial functions
Meaningful experience in one of the verticals
Above-average degree in business administration, economics, psychology, media or similar fields  
Native level in German, as well as fluency in English
Empathy and a good sense for the needs of the person opposite you
Entrepreneurial mindset, problem-solver, and just simply an amazing person to be around with!

OUR BENEFITS 

Flexibility Policy - meaning you are free to take off as many paid vacation days as you need, no maximum
Work-from-anywhere Policy - meaning you have the chance to develop our amazing product anywhere in the world -within reason ;-)
Subsidized Urban Sports Club membership
All the hardware you need and your own MacBook
In case you're located in Hamburg you'll get a subsidized HVV ticket or if you're located in Hamburg or Berlin you'll get access to a mobility budget with the RYDES app
In case you're located in Hamburg you'll get access to our beautiful office in Hamburg's city center - terrace and BBQ included ;-)

 









 










ABOUT APPINIO


At Appinio, we help companies always make the right decisions through real-time market research. As the world’s largest opinion network, we collect millions of responses from consumers every day to allow our clients to turn their questions to insights in minutes. Over 2000+ companies worldwide rely on us to understand how their consumers think.
 
We started small in Hamburg back in 2014 but we’re now humbled to call the world our playground, with over +200 employees spread across 25 countries, 2000 international clients and a panel reach of 7 million, globally.
 
Appinio is an equal opportunity employer. All applicants will be considered for employment without attention to race, color, religion, sex, sexual orientation, gender identity, national origin, veteran or disability status.
 






Learn more about us:

 appinio.com    LinkedIn    Xing     Kununu    Instagram










 
 
 




",https://boards.eu.greenhouse.io/appinio/jobs/4017467101
"Accountant (""Bilanzbuchhalter"") (m/f/d) ",Finance,Remote,,"

YOUR ROLE
We are looking for an experienced and reliable Accountant (m/f/d) to join our finance team. In this highly responsible position, you will be in charge of diverse day-to-day accounting aspects of Appinio. As our Accountant (m/f/d) you will focus on developing and maintaining sound financial controls and work closely with our Head of Finance. In addition, you will be responsible for preparing our monthly and annual reports for internal and external stakeholders. 
You will be an ideal fit for this role if you have an excellent knowledge of debtors and creditors accounting, as well as German tax and accounting regulations. In addition, you are passionate about tech, love a fast-paced work environment and are looking for a high-impact role as well as the opportunity to develop a solid finance/accounting function.  
 
YOUR TASKS

Gather, monitor and record financial data (eg. sales revenues and liabilities)
Monitor and report on accounting discrepancies to internal and external stakeholders
Perform month-end and year-end close processes
Manage all accounting transactions from external stakeholders and ensure timely bank payments
Reconcile accounts payable and receivable

YOUR PROFILE

Minimum 2 years of work experience as a Financial Accountant or a similar role  - ideally in a start-up or other fast-paced environment 
Completed accounting apprenticeship, ideally with German additional qualification as ""Finanzbuchhalter""
Very comfortable with German tax and accounting standards, knowledge in UK/US-GAAP is a plus
Proven experience in Datev and MS Excel
In-depth understanding of business accounting procedures
KPI-driven and analytical mindset
Positive and helpful attitude, as well as a pragmatic approach
German skills at native-speaker-level as well as fluency in English

OUR BENEFITS 

Flexibility Policy - meaning you are free to take off as many paid vacation days as you need, no maximum
Work-from-anywhere Policy - meaning you have the chance to develop our amazing product anywhere in the world -within reason
Subsidized Urban Sports Club membership
All the hardware you need and your own MacBook
In case you're located in Hamburg you'll get a subsidized HVV ticket or if you're located in Hamburg or Berlin you'll get access to a mobility budget with the RYDES app
In case you're located in Hamburg you'll get access to our beautiful office in Hamburg's city center - terrace and BBQ included 

 






ABOUT APPINIO


At Appinio, we help companies always make the right decisions through real-time market research. As the world’s largest opinion network, we collect millions of responses from consumers every day to allow our clients to turn their questions to insights in minutes. Over 2000+ companies worldwide rely on us to understand how their consumers think.
 
We started small in Hamburg back in 2014 but we’re now humbled to call the world our playground, with over +200 employees spread across 25 countries, 2000 international clients and a panel reach of 7 million, globally.
 
Appinio is an equal opportunity employer. All applicants will be considered for employment without attention to race, color, religion, sex, sexual orientation, gender identity, national origin, veteran or disability status.












 


Learn more about us:

 appinio.com    LinkedIn    Xing     Kununu    Instagram
 
 




",https://boards.eu.greenhouse.io/appinio/jobs/4066417101
