Registered Nurse (RN) - Full Time,*Nursing,Belmont Behavioral Hospital,Full Time,"We are looking to add compassionate RNs to our nurse team! Belmont Behavioral Hospital is a 180-bed treatment center providing services to children, adults, and adolescents on both an inpatient and outpatient basis. 
We are currently seeking a Full-time Registered Nurse (RN) at Belmont Behavioral Hospital.
BENEFITS:
Belmont provides a comprehensive package of benefits for our (Part-Time Benefit eligible and Full-Time positions). 
Current benefits include:

Sign-on Bonus $10,000
Competitive hourly rate with shift differential available
Medical, dental, and vision insurance
Acadia Healthcare 401(k) plan
Excellent training program
Professional growth opportunity that is second to none in the industry.

 
AVAILABLE SHIFTS AND HOURS 
We have full-time, and part-time w benefits RN positions available for day, evening, and night shifts). We both 8hr and 12hr shifts. All RNs rotate weekend shifts.
TRAINING AND ORIENTATION 
Belmont is committed to training and safety. All new-hire RNs will attend a 5-day hospital-wide orientation before spending 2 weeks in unit orientation with a preceptor. 
 
The Registered Nurse:

Provides and coordinates care by assessing the patient's physical and behavioral health needs, developing and implementing nursing care plans, maintaining medical records, and educating patients and their families about various physical and behavioral health conditions. 
Provides nursing care and services within the standards and scope of nursing practice as defined within the state Nurse Practice Act regulations, policies, procedures, and protocols, as well as facility and corporate policies and procedures.
Ensure physician’s orders are legible if taken verbally and transcribed appropriately per policy and procedure.
Ensure patient’s status is assessed on an ongoing basis, and pertinent information is documented. Notify physician of significant changes in status such as difficulties with detox, medical emergency, or change in medical status regarding response to medications, etc.
Nursing treatment plans are specific to assessed needs. The initial treatment plan is completed upon admission.

The ideal candidate will:

Graduated from an accredited school of nursing.
Current Registered Nurse (RN) license in the State of Pennsylvania
Current Mandated Reporting Training and CPR certification are required.
Previous psych nursing experience is highly preferred.

 ",https://recruiting.ultipro.com/ACA1001/JobBoard/f24b6286-a80b-4d02-e4e1-ad04762a00de/OpportunityDetail?opportunityId=9da89d73-b4c2-4050-a845-cb7871db03bb
Board Certified Behavioral Analyst -  BCBA - Full time,*Therapeutic Services,Belmont Behavioral Hospital,Full Time,"Belmont Behavioral Hospital is a premiere provider of comprehensive treatment for mental health conditions and substance abuse problems. Having been in operation for over 75 years as one of the most prominent providers of behavioral healthcare treatment services, Belmont is proud to offer high quality and specialized programming options for children, adolescents, adults, and older adults who are suffering from psychiatric concerns and chemical dependency.
We are currently seeking a Full time, Board-Certified Behavioral Analyst (BCBA) position, in our STAR (Specialized Treatment for Autism and Related Disorders) , at Belmont Behavioral Hospital.
The primary function of the Board-Certified Behavioral Analyst (BCBA) is to plan, develop, and monitor a variety of behavioral support service delivery options to meet the needs of persons receiving services (PRS) diagnosed with Autism Spectrum Disorders (ASD) and/or other behavioral and social/communication challenges. The BCBA also consults with and teaches clinical team members regarding pro-active, educational and behavioral supports; develops and implements comprehensive treatment plans; conducts behavioral evaluations of PRS and designs behavior and individual support plans and collaborates with clinical team members, educators, families, and other providers as appropriate. The BCBA supports the child and adolescent units and provides ongoing training and direct support to team members.
The ideal candidate will:

Master’s or Doctoral Applied Behavioral Analysis conferred by an accredited program, or otherwise meet the BACB eligibility requirements to become a BCBA.
Two or more years’ experience working with children and adolescents with autism spectrum disorders with a demonstrated understanding of the principals of behavioral management preferred.
Experience in working with children and families required
",https://recruiting.ultipro.com/ACA1001/JobBoard/f24b6286-a80b-4d02-e4e1-ad04762a00de/OpportunityDetail?opportunityId=d3a0242c-dc76-45ab-8d6d-8d0b94aa42c9
Behavioral Health Associate- Full-Time,*Nursing,Belmont Behavioral Hospital,Full Time,"Belmont Behavioral Hospital is a premiere provider of comprehensive treatment for mental health conditions and substance abuse problems. Belmont has been operating for over 75 years as one of the most prominent behavioral healthcare treatment services. Belmont is proud to offer high-quality and specialized programming options for children, adolescents, adults, and older adults suffering from psychiatric concerns and chemical dependency.
We are currently seeking a Full-Time Behavioral Health Associate. 
Under the direction and supervision of a Registered Nurse, this role completes a portion of the patient assessment, provides patient care, assesses units for safety, and maintains complete and accurate documentation. Leads and co-leads therapeutic activities.
The ideal candidate will have: 
High school diploma or equivalent (GED) along with at least 12 behavioral health college credits and 2 years of experience in Human Services and/or Behavioral Health.
 Or 
 Bachelor's degree in a human services field and 1-year experience in Human Services and/or Behavioral Health. 

Current CPR certification is required.
Registered Behavior Technician (RBT) certification preferred. 

 ",https://recruiting.ultipro.com/ACA1001/JobBoard/f24b6286-a80b-4d02-e4e1-ad04762a00de/OpportunityDetail?opportunityId=80dbe4d4-50b4-4db7-8be6-b24ee8d2d6c9
Behavioral Health Associate- Part-Time,*Nursing,Belmont Behavioral Hospital,Part Time,"Belmont Behavioral Hospital is a premiere provider of comprehensive treatment for mental health conditions and substance abuse problems. Belmont has been operating for over 75 years as one of the most prominent behavioral healthcare treatment services. Belmont is proud to offer high-quality and specialized programming options for children, adolescents, adults, and older adults suffering from psychiatric concerns and chemical dependency.
We are currently seeking a Part-Time Behavioral Health Associate. 
Under the direction and supervision of a Registered Nurse, this role completes a portion of the patient assessment, provides patient care, assesses units for safety, and maintains complete and accurate documentation. Leads and co-leads therapeutic activities.
The ideal candidate will have: 
High school diploma or equivalent (GED) along with at least 12 behavioral health college credits and 2 years of experience in Human Services and/or Behavioral Health.
 Or 
 Bachelor's degree in a human services field and 1-year experience in Human Services and/or Behavioral Health. 

Current CPR certification is required.
Registered Behavior Technician (RBT) certification preferred. 

 ",https://recruiting.ultipro.com/ACA1001/JobBoard/f24b6286-a80b-4d02-e4e1-ad04762a00de/OpportunityDetail?opportunityId=0dbe8687-742f-4447-8916-73b0c2711517
Admissions Counselor - PT - Every Other Saturday Evening Night Shift,*Admissions,Belmont Behavioral Hospital,Part Time,"Belmont Behavioral Hospital is a premiere provider of comprehensive treatment for mental health conditions and substance abuse problems. Having been in operation for over 75 years as one of the most prominent providers of behavioral healthcare treatment services, Belmont is proud to offer high quality and specialized programming options for children, adolescents, adults, and older adults who are suffering from psychiatric concerns and chemical dependency.
Belmont Behavioral Hospital is looking for qualified candidates for an part-time Admission Counselor position, in our Access Center. 
The Admission Counselor is the primary facilitator for all admissions being presented to Belmont. The Admission Counselor is responsible for gathering and assessing (within the context of Belmont admission criteria) patient clinical information for the purpose of making appropriate admission decisions. The Admission Counselor routinely interfaces with external referral sources, patients, insurance companies and internal staff to facilitate the successful admission of the patient into Belmont. This process includes frequently gathering clinical information on complex medical cases to review with the psychiatrist to make appropriate clinical decisions. Frequently the Admission Counselor is called upon to give an in depth clinical presentation to the insurance company in order to obtain authorization for the inpatient stay.   This position also includes the use of excellent customer service skills, in very challenging situations, to build very good relationships with both external and internal customers. The ability to build excellent relationships with all customers is key to this position.
The Admission Counselor is also responsible for the gathering of clinical information from patients, family members and other referral sources for the purpose of linking patients with appropriate outpatient services throughout Belmont Behavioral Health. They are responsible for knowing what services are available and what the criteria are for entry into those programs.
 Other significant functions include:
 1)      Oversee management of the hospital bed board.
2)      Responsible for physician assignment of all patients being admitted to Belmont.
3)      Assist patient in completion of all admission paperwork.
4)      Registration of all Admissions.
5)      Outpatient Centralized Scheduling.
Qualified candidates will have a Master's degree in a Therapeutic Counseling, Behavioral Science, Social Work or related field. In some states, may also be a registered nurse, in which case, an associate's or bachelor's degree in nursing is required.

Three plus years of mental/behavioral health experience working with individuals in a clinical or observational capacity, preferably within the area of specialty for the facility.
Experience in the managed care pre-certification process, level of care assessments and utilization.

 
Night Shift: 7:00pm to 7:30am (12hrs) every other week and every other weekend required.
 ",https://recruiting.ultipro.com/ACA1001/JobBoard/f24b6286-a80b-4d02-e4e1-ad04762a00de/OpportunityDetail?opportunityId=80d4d1bb-fa21-4d9a-b68c-78903dd60fb3
Registered Nurse (RN) - Part-Time,*Nursing,Belmont Behavioral Hospital,Part Time,"We are looking to add compassionate RNs to our nurse team! Belmont Behavioral Hospital is a 252-bed treatment center providing services to children, adolescents, and adults in an inpatient setting. Every day you are with us, you will make a vital contribution to the health and well-being of individuals in crisis and their loved ones.
We are currently seeking a Part-time Registered Nurse (RN) at Belmont Behavioral Hospital.
BENEFITS:
Belmont provides a comprehensive package of benefits for our ( Part-Time positions). 
Current benefits include:

Sign-on Bonus of $2,500
Competitive hourly rate with shift differential available
Excellent training program
Professional growth opportunity that is second to none in the industry.

 
AVAILABLE SHIFTS AND HOURS 
We have part-time staff RN positions available for day, evening, and night shifts). We offer both 8hr and12hr shifts. All RNs rotate weekend shifts.
TRAINING AND ORIENTATION 
Belmont is committed to training and safety. All new-hire RNs will attend a 6-day hospital-wide orientation before spending 2 weeks in unit orientation with a preceptor. 
 
The Registered Nurse:

Provides and coordinates care by assessing the patient's physical and behavioral health needs, developing and implementing nursing care plans, maintaining medical records, and educating patients and their families about various physical and behavioral health conditions. 
Provides nursing care and services within the standards and scope of nursing practice as defined within the state Nurse Practice Act regulations, policies, procedures, and protocols, as well as facility and corporate policies and procedures.
Ensure physician’s orders are legible if taken verbally and transcribed appropriately per policy and procedure.
Ensure patient’s status is assessed on an ongoing basis, and pertinent information is documented. Notify physician of significant changes in status such as difficulties with detox, medical emergency, or change in medical status regarding response to medications, etc.
Nursing treatment plans are specific to assessed needs. The initial treatment plan is completed upon admission.

The ideal candidate will:

Graduated from an accredited school of nursing.
Current Registered Nurse (RN) license in the State of Pennsylvania
Current Mandated Reporting Training and CPR certification are required.
Previous psych nursing experience is highly preferred.

 ",https://recruiting.ultipro.com/ACA1001/JobBoard/f24b6286-a80b-4d02-e4e1-ad04762a00de/OpportunityDetail?opportunityId=df8b4e62-f9c4-4add-bbab-bc855d3b05b0
